{"schema_version":1,"oracle_version":"taskgate-final-v5-independent-oracle-v1","contract_version":"taskgate-final-v5-author-contract-v1","experiment_id":"scale","workload_id":"dependency-e2e","scale":"1035000-overlap-90","mode":"semantic_replay","dataset_spec_sha256":"2f67aa9ee55dd6eb2d7da4eaf1c8d50fd7e5e65f65492f7f1bb231d1c1f25027","catalog_spec_sha256":"dcb26eaabe6e5612d4d58ddf09dcfbf9e7db00e1a37570ced6e6af0259bbd243","query_spec_sha256":"aa36d0260315b648079d01e78a36b1ec87f3f371e150477d7f8ab47920d7a2b2","normalization_spec_sha256":"2eb64f136ffc164f078517e9604db907543ff02ae86a1249b0cb90bb44cf0f64","expected":{"row_count":1,"column_count":1,"normalized_schema_sha256":"56f599290f1abf6595d635262b973b8eb26db02e04f8b7aaebcc582df7cbe4e2","canonical_result_sha256":"48f7de9160702299adc2cb00311d9d23c378dcd30c6100e34a143346abecdfe1","release_candidate_cardinality":1,"dependency_candidate_cardinality":1035000,"release_candidate_set_sha256":"1a24cf7d957aeadb78a9d73d779662b2fc0c48a570abc674da817903a1452a79","dependency_candidate_set_sha256":"5d63478f9799ccd4635efded18e17bbb391dd753cdc9e9c429cb668d3c36c09b","existing_cardinality":1035000,"existing_set_sha256":"a9956838a1d7cfc92d58929b4913ad59bd0d4c64140508f7bb37da7b4c1ffecd","overlap_cardinality":931500,"overlap_set_sha256":"f472b4ea88a7677b7ff0efa8671bced2afffd85f465e82e303e626ae9b7f3b43","novel_cardinality":103500,"novel_set_sha256":"17c1d79b82afad5c2ec2ad452ca2389ad49339dcc495780dff6ee0bab11bdaf3","union_cardinality":1138500,"union_set_sha256":"aeb72976d4b2f7b53b9cbb2561786a72f07d0b4663757b2b0bb789a12251b1eb"},"generation":{"seed":20260803,"generator_version":"taskgate-final-v5-exposure-scale-semantic-manifest-v1","command":"final-v5-oracle scale-manifests --dataset-spec-sha256 2f67aa9ee55dd6eb2d7da4eaf1c8d50fd7e5e65f65492f7f1bb231d1c1f25027 --catalog-spec-sha256 dcb26eaabe6e5612d4d58ddf09dcfbf9e7db00e1a37570ced6e6af0259bbd243 --query-spec-sha256 aa36d0260315b648079d01e78a36b1ec87f3f371e150477d7f8ab47920d7a2b2 --normalization-spec-sha256 2eb64f136ffc164f078517e9604db907543ff02ae86a1249b0cb90bb44cf0f64"}}
