{"schema_version":1,"oracle_version":"taskgate-final-v5-independent-oracle-v1","contract_version":"taskgate-final-v5-author-contract-v1","experiment_id":"scale","workload_id":"dependency-e2e","scale":"10k-overlap-50","mode":"semantic_replay","dataset_spec_sha256":"dbc151e0111c3a9e0e7dcac7564a3f2e9de0f0ebd285b5fad58446b68aec18de","catalog_spec_sha256":"5bdb17be095208e418058b11b4f7d65f0e3fa15635e7c25de8910c099aaefa9e","query_spec_sha256":"aa36d0260315b648079d01e78a36b1ec87f3f371e150477d7f8ab47920d7a2b2","normalization_spec_sha256":"9e78abdc2130b19cb414d520edeb6da4dfac0f481609efd244f22f6ba2b1e816","expected":{"row_count":1,"column_count":1,"normalized_schema_sha256":"56f599290f1abf6595d635262b973b8eb26db02e04f8b7aaebcc582df7cbe4e2","canonical_result_sha256":"9528745fee7030eb82173d2ba6fa7ad5750da1dee0396a372eac08049ea2ee46","release_candidate_cardinality":1,"dependency_candidate_cardinality":10000,"release_candidate_set_sha256":"b2d2feb8a38b0a36450c75ed0ce3a998991d97a1abe060500a13a8f3b639c0cc","dependency_candidate_set_sha256":"d0f6452e4e475a91aa850a7a63a1e6108c72dafcde717805aedc566beb0ecf54","existing_cardinality":10000,"existing_set_sha256":"0fd0311444b77c60a75be1c0e5ddfa39813c015f21c6842016ac65080586efea","overlap_cardinality":5000,"overlap_set_sha256":"6d76cf2fbc5a4ddb2ddf96fd6cb8143b94a354f6b64f4953f7ab981816f4db6a","novel_cardinality":5000,"novel_set_sha256":"b165c89afad45313769fe92ca4bff6901ff6655cc2de7525b312dc6bcd7614a9","union_cardinality":15000,"union_set_sha256":"060b8a69030209778c7b4dc6f1329a09aceb9a16d97b5f14975e50b479cbe885"},"generation":{"seed":20260803,"generator_version":"taskgate-final-v5-exposure-scale-semantic-manifest-v1","command":"final-v5-oracle scale-manifests --dataset-spec-sha256 dbc151e0111c3a9e0e7dcac7564a3f2e9de0f0ebd285b5fad58446b68aec18de --catalog-spec-sha256 5bdb17be095208e418058b11b4f7d65f0e3fa15635e7c25de8910c099aaefa9e --query-spec-sha256 aa36d0260315b648079d01e78a36b1ec87f3f371e150477d7f8ab47920d7a2b2 --normalization-spec-sha256 9e78abdc2130b19cb414d520edeb6da4dfac0f481609efd244f22f6ba2b1e816"}}
