{"schema_version":1,"oracle_version":"taskgate-final-v5-independent-oracle-v1","contract_version":"taskgate-final-v5-author-contract-v1","experiment_id":"artifact","workload_id":"result-heavy","scale":"100x4","mode":"novel","dataset_spec_sha256":"402534b70f6251e452891bc1c57ed19e79637fcc27238c92f65a4f86b387a8ec","catalog_spec_sha256":"d691a58ef73ac7746ad2eb926c6d5999aae9d2646a34c9f0513616e380f29a8d","query_spec_sha256":"6da513200e029861efe3364190160fe0e068f211b5f24422aabb7f7c9f318edc","normalization_spec_sha256":"9e78abdc2130b19cb414d520edeb6da4dfac0f481609efd244f22f6ba2b1e816","expected":{"row_count":100,"column_count":4,"normalized_schema_sha256":"7cdc7fd5f759f6e7a3ff73de33ff9124a8902085e0f00b349e0b74bd8a821f98","canonical_result_sha256":"e9a6f28caed552217cd30da5d405c08bda1d0e73099a0a3918093d697623ddf6"},"generation":{"seed":20260803,"generator_version":"taskgate-final-v5-result-heavy-generator-v1","command":"final-v5-oracle artifact-manifest --row-count 100 --column-count 4 --dataset-spec-sha256 402534b70f6251e452891bc1c57ed19e79637fcc27238c92f65a4f86b387a8ec --catalog-spec-sha256 d691a58ef73ac7746ad2eb926c6d5999aae9d2646a34c9f0513616e380f29a8d --query-spec-sha256 6da513200e029861efe3364190160fe0e068f211b5f24422aabb7f7c9f318edc --normalization-spec-sha256 9e78abdc2130b19cb414d520edeb6da4dfac0f481609efd244f22f6ba2b1e816"}}
