{"schema_version":1,"oracle_version":"taskgate-final-v5-independent-oracle-v1","contract_version":"taskgate-final-v5-author-contract-v1","experiment_id":"scale","workload_id":"dependency-e2e","scale":"10k-overlap-90","mode":"novel","dataset_spec_sha256":"dbc151e0111c3a9e0e7dcac7564a3f2e9de0f0ebd285b5fad58446b68aec18de","catalog_spec_sha256":"5bdb17be095208e418058b11b4f7d65f0e3fa15635e7c25de8910c099aaefa9e","query_spec_sha256":"aa36d0260315b648079d01e78a36b1ec87f3f371e150477d7f8ab47920d7a2b2","normalization_spec_sha256":"9e78abdc2130b19cb414d520edeb6da4dfac0f481609efd244f22f6ba2b1e816","expected":{"row_count":1,"column_count":1,"normalized_schema_sha256":"56f599290f1abf6595d635262b973b8eb26db02e04f8b7aaebcc582df7cbe4e2","canonical_result_sha256":"9528745fee7030eb82173d2ba6fa7ad5750da1dee0396a372eac08049ea2ee46","release_candidate_cardinality":1,"dependency_candidate_cardinality":10000,"release_candidate_set_sha256":"b2d2feb8a38b0a36450c75ed0ce3a998991d97a1abe060500a13a8f3b639c0cc","dependency_candidate_set_sha256":"d0f6452e4e475a91aa850a7a63a1e6108c72dafcde717805aedc566beb0ecf54","existing_cardinality":10000,"existing_set_sha256":"a8c39ad67d85a97ca9382cbcb8d3f9220ff12cb71e15318fc39938f863744854","overlap_cardinality":9000,"overlap_set_sha256":"a7eb97c134ffd89ddc9ad2122c4bd84563b3be2b51d6892693cb8f5cc9e16210","novel_cardinality":1000,"novel_set_sha256":"6821d0963134ee2fb6694ac3b0e57421685b86907a6b2baaa7b6e01e992e5580","union_cardinality":11000,"union_set_sha256":"3ff443a6088aa0f4f2f1a95cc4e093e9564739febd68c9422f9223267a7f1389"},"generation":{"seed":20260803,"generator_version":"taskgate-final-v5-exposure-scale-semantic-manifest-v1","command":"final-v5-oracle scale-manifests --dataset-spec-sha256 dbc151e0111c3a9e0e7dcac7564a3f2e9de0f0ebd285b5fad58446b68aec18de --catalog-spec-sha256 5bdb17be095208e418058b11b4f7d65f0e3fa15635e7c25de8910c099aaefa9e --query-spec-sha256 aa36d0260315b648079d01e78a36b1ec87f3f371e150477d7f8ab47920d7a2b2 --normalization-spec-sha256 9e78abdc2130b19cb414d520edeb6da4dfac0f481609efd244f22f6ba2b1e816"}}
