{"schema_version":1,"oracle_version":"taskgate-final-v5-independent-oracle-v1","contract_version":"taskgate-final-v5-author-contract-v1","experiment_id":"scale","workload_id":"dependency-e2e","scale":"100k-overlap-50","mode":"novel","dataset_spec_sha256":"2f67aa9ee55dd6eb2d7da4eaf1c8d50fd7e5e65f65492f7f1bb231d1c1f25027","catalog_spec_sha256":"9d43f8206879423cae808b9d8ffa10e1bf57334019f5672a86d6f0c23b8d4772","query_spec_sha256":"aa36d0260315b648079d01e78a36b1ec87f3f371e150477d7f8ab47920d7a2b2","normalization_spec_sha256":"9e78abdc2130b19cb414d520edeb6da4dfac0f481609efd244f22f6ba2b1e816","expected":{"row_count":1,"column_count":1,"normalized_schema_sha256":"56f599290f1abf6595d635262b973b8eb26db02e04f8b7aaebcc582df7cbe4e2","canonical_result_sha256":"0ec0a2a22e7e185f12257f7f45060f67c0b3754d4d11f7acff860f47ea63fa0c","release_candidate_cardinality":1,"dependency_candidate_cardinality":100000,"release_candidate_set_sha256":"7301d8129f3e2f14c8d1126b872aaf5bf1d842205ca5ffaf08502d181f607410","dependency_candidate_set_sha256":"e2e4dfc1f7763f8351d8d0bfa73f70b1474fc3f0f8abf9edb9c6ea987cdecf99","existing_cardinality":100000,"existing_set_sha256":"69dc3df2f3b277011d5841aa02df70112efb1d018fe249fb4e4861e395cef20e","overlap_cardinality":50000,"overlap_set_sha256":"1bf798dd2cad1549289e5161e38a189afb657dfea4967229b5a5e67cd3b3a2b7","novel_cardinality":50000,"novel_set_sha256":"589364e101a491d85a82ebbaf2b1b7729d54c493de9701e5c958ffeb87d9f1e4","union_cardinality":150000,"union_set_sha256":"beb3e228f3379e810347bb4ae7fc409e6d802c62419387455b14796beda20835"},"generation":{"seed":20260803,"generator_version":"taskgate-final-v5-exposure-scale-semantic-manifest-v1","command":"final-v5-oracle scale-manifests --dataset-spec-sha256 2f67aa9ee55dd6eb2d7da4eaf1c8d50fd7e5e65f65492f7f1bb231d1c1f25027 --catalog-spec-sha256 9d43f8206879423cae808b9d8ffa10e1bf57334019f5672a86d6f0c23b8d4772 --query-spec-sha256 aa36d0260315b648079d01e78a36b1ec87f3f371e150477d7f8ab47920d7a2b2 --normalization-spec-sha256 9e78abdc2130b19cb414d520edeb6da4dfac0f481609efd244f22f6ba2b1e816"}}
