{"schema_version":1,"oracle_version":"taskgate-final-v5-independent-oracle-v1","contract_version":"taskgate-final-v5-author-contract-v1","experiment_id":"artifact","workload_id":"result-heavy","scale":"10k-x4","mode":"novel","dataset_spec_sha256":"dbc151e0111c3a9e0e7dcac7564a3f2e9de0f0ebd285b5fad58446b68aec18de","catalog_spec_sha256":"29365a1dc61de069e99798f385c976229f5fe42db036aab930561b4f285f89c7","query_spec_sha256":"6da513200e029861efe3364190160fe0e068f211b5f24422aabb7f7c9f318edc","normalization_spec_sha256":"9e78abdc2130b19cb414d520edeb6da4dfac0f481609efd244f22f6ba2b1e816","expected":{"row_count":10000,"column_count":4,"normalized_schema_sha256":"7cdc7fd5f759f6e7a3ff73de33ff9124a8902085e0f00b349e0b74bd8a821f98","canonical_result_sha256":"0efd8bf61b0f416494a38560a8f6e93e92381e852ef22582808e130cd42e8b0d"},"generation":{"seed":20260803,"generator_version":"taskgate-final-v5-result-heavy-generator-v1","command":"final-v5-oracle artifact-manifest --row-count 10000 --column-count 4 --dataset-spec-sha256 dbc151e0111c3a9e0e7dcac7564a3f2e9de0f0ebd285b5fad58446b68aec18de --catalog-spec-sha256 29365a1dc61de069e99798f385c976229f5fe42db036aab930561b4f285f89c7 --query-spec-sha256 6da513200e029861efe3364190160fe0e068f211b5f24422aabb7f7c9f318edc --normalization-spec-sha256 9e78abdc2130b19cb414d520edeb6da4dfac0f481609efd244f22f6ba2b1e816"}}
