{"schema_version":1,"oracle_version":"taskgate-final-v5-independent-oracle-v1","contract_version":"taskgate-final-v5-author-contract-v1","experiment_id":"scale","workload_id":"dependency-e2e","scale":"10k-overlap-0","mode":"semantic_replay","dataset_spec_sha256":"2f67aa9ee55dd6eb2d7da4eaf1c8d50fd7e5e65f65492f7f1bb231d1c1f25027","catalog_spec_sha256":"ce6d130263a9c343a2e8b297964a11401fe85c453622ba1dcd820560a9ae8253","query_spec_sha256":"aa36d0260315b648079d01e78a36b1ec87f3f371e150477d7f8ab47920d7a2b2","normalization_spec_sha256":"9e78abdc2130b19cb414d520edeb6da4dfac0f481609efd244f22f6ba2b1e816","expected":{"row_count":1,"column_count":1,"normalized_schema_sha256":"56f599290f1abf6595d635262b973b8eb26db02e04f8b7aaebcc582df7cbe4e2","canonical_result_sha256":"9528745fee7030eb82173d2ba6fa7ad5750da1dee0396a372eac08049ea2ee46","release_candidate_cardinality":1,"dependency_candidate_cardinality":10000,"release_candidate_set_sha256":"b2d2feb8a38b0a36450c75ed0ce3a998991d97a1abe060500a13a8f3b639c0cc","dependency_candidate_set_sha256":"d0f6452e4e475a91aa850a7a63a1e6108c72dafcde717805aedc566beb0ecf54","existing_cardinality":10000,"existing_set_sha256":"98a92106ae1b9ac9379cad0e3977cf9985b19ece54b49e117651d4a0efcfeada","overlap_cardinality":0,"overlap_set_sha256":"a8eb28f8cccb8f04c699288b486ccf4faa490571cd09ea32f2231915cb10075d","novel_cardinality":10000,"novel_set_sha256":"3ad5927a2add55268b9ba6ea774ac38ce52e939ab1acf1668479c28cd495f6ec","union_cardinality":20000,"union_set_sha256":"876a733591dc6003fae14f10ff0bfd267a2896fb7cc43939cf3147f49a579126"},"generation":{"seed":20260803,"generator_version":"taskgate-final-v5-exposure-scale-semantic-manifest-v1","command":"final-v5-oracle scale-manifests --dataset-spec-sha256 2f67aa9ee55dd6eb2d7da4eaf1c8d50fd7e5e65f65492f7f1bb231d1c1f25027 --catalog-spec-sha256 ce6d130263a9c343a2e8b297964a11401fe85c453622ba1dcd820560a9ae8253 --query-spec-sha256 aa36d0260315b648079d01e78a36b1ec87f3f371e150477d7f8ab47920d7a2b2 --normalization-spec-sha256 9e78abdc2130b19cb414d520edeb6da4dfac0f481609efd244f22f6ba2b1e816"}}
