{"schema_version":1,"oracle_version":"taskgate-final-v5-independent-oracle-v1","contract_version":"taskgate-final-v5-author-contract-v1","experiment_id":"scale","workload_id":"dependency-e2e","scale":"100k-overlap-90","mode":"novel","dataset_spec_sha256":"2f67aa9ee55dd6eb2d7da4eaf1c8d50fd7e5e65f65492f7f1bb231d1c1f25027","catalog_spec_sha256":"dcb26eaabe6e5612d4d58ddf09dcfbf9e7db00e1a37570ced6e6af0259bbd243","query_spec_sha256":"aa36d0260315b648079d01e78a36b1ec87f3f371e150477d7f8ab47920d7a2b2","normalization_spec_sha256":"9e78abdc2130b19cb414d520edeb6da4dfac0f481609efd244f22f6ba2b1e816","expected":{"row_count":1,"column_count":1,"normalized_schema_sha256":"56f599290f1abf6595d635262b973b8eb26db02e04f8b7aaebcc582df7cbe4e2","canonical_result_sha256":"0ec0a2a22e7e185f12257f7f45060f67c0b3754d4d11f7acff860f47ea63fa0c","release_candidate_cardinality":1,"dependency_candidate_cardinality":100000,"release_candidate_set_sha256":"7301d8129f3e2f14c8d1126b872aaf5bf1d842205ca5ffaf08502d181f607410","dependency_candidate_set_sha256":"e2e4dfc1f7763f8351d8d0bfa73f70b1474fc3f0f8abf9edb9c6ea987cdecf99","existing_cardinality":100000,"existing_set_sha256":"65ac92edcb2ee4e07f4affae9e646603964ead789d1a9c5941a994d4ba4b7df9","overlap_cardinality":90000,"overlap_set_sha256":"e1eef373a8c6a8b3a9072a3860217702b5216584a207ac0991607fd284daea99","novel_cardinality":10000,"novel_set_sha256":"3ad5927a2add55268b9ba6ea774ac38ce52e939ab1acf1668479c28cd495f6ec","union_cardinality":110000,"union_set_sha256":"7bbfd350d8b2339af4c8674002b96c714554157514ee1de926b6600b2aefad3e"},"generation":{"seed":20260803,"generator_version":"taskgate-final-v5-exposure-scale-semantic-manifest-v1","command":"final-v5-oracle scale-manifests --dataset-spec-sha256 2f67aa9ee55dd6eb2d7da4eaf1c8d50fd7e5e65f65492f7f1bb231d1c1f25027 --catalog-spec-sha256 dcb26eaabe6e5612d4d58ddf09dcfbf9e7db00e1a37570ced6e6af0259bbd243 --query-spec-sha256 aa36d0260315b648079d01e78a36b1ec87f3f371e150477d7f8ab47920d7a2b2 --normalization-spec-sha256 9e78abdc2130b19cb414d520edeb6da4dfac0f481609efd244f22f6ba2b1e816"}}
