{"schema_version":1,"oracle_version":"taskgate-final-v5-independent-oracle-v1","contract_version":"taskgate-final-v5-author-contract-v1","experiment_id":"scale","workload_id":"dependency-e2e","scale":"100k-overlap-0","mode":"semantic_replay","dataset_spec_sha256":"f23ff70fda780bfb1a65f91a3e785dc5b4a990f076e3dea971e240bdae47f1a3","catalog_spec_sha256":"171db552e0c9d0a7f66cd18e161338b23e32b5be5fbddbd5e9c9af0787fffb30","query_spec_sha256":"aa36d0260315b648079d01e78a36b1ec87f3f371e150477d7f8ab47920d7a2b2","normalization_spec_sha256":"9e78abdc2130b19cb414d520edeb6da4dfac0f481609efd244f22f6ba2b1e816","expected":{"row_count":1,"column_count":1,"normalized_schema_sha256":"56f599290f1abf6595d635262b973b8eb26db02e04f8b7aaebcc582df7cbe4e2","canonical_result_sha256":"0ec0a2a22e7e185f12257f7f45060f67c0b3754d4d11f7acff860f47ea63fa0c","release_candidate_cardinality":1,"dependency_candidate_cardinality":100000,"release_candidate_set_sha256":"7301d8129f3e2f14c8d1126b872aaf5bf1d842205ca5ffaf08502d181f607410","dependency_candidate_set_sha256":"e2e4dfc1f7763f8351d8d0bfa73f70b1474fc3f0f8abf9edb9c6ea987cdecf99","existing_cardinality":100000,"existing_set_sha256":"1bc476db7c8b23b41ecda5d8abd8cf3cc4a879252e29ac45b0f90c980e6e4e17","overlap_cardinality":0,"overlap_set_sha256":"a8eb28f8cccb8f04c699288b486ccf4faa490571cd09ea32f2231915cb10075d","novel_cardinality":100000,"novel_set_sha256":"d0c2d4fcd4daf396ef07fa1cb7c6e2da12d733307be686fa5f2887664eea2a98","union_cardinality":200000,"union_set_sha256":"444f28a97aafaea70d6e7b1054c0782f9a4775836c09316f7b05923eed734165"},"generation":{"seed":20260803,"generator_version":"taskgate-final-v5-exposure-scale-semantic-manifest-v1","command":"final-v5-oracle scale-manifests --dataset-spec-sha256 f23ff70fda780bfb1a65f91a3e785dc5b4a990f076e3dea971e240bdae47f1a3 --catalog-spec-sha256 171db552e0c9d0a7f66cd18e161338b23e32b5be5fbddbd5e9c9af0787fffb30 --query-spec-sha256 aa36d0260315b648079d01e78a36b1ec87f3f371e150477d7f8ab47920d7a2b2 --normalization-spec-sha256 9e78abdc2130b19cb414d520edeb6da4dfac0f481609efd244f22f6ba2b1e816"}}
