{"schema_version":1,"oracle_version":"taskgate-final-v5-independent-oracle-v1","contract_version":"taskgate-final-v5-author-contract-v1","experiment_id":"scale","workload_id":"dependency-e2e","scale":"1035000-overlap-50","mode":"semantic_replay","dataset_spec_sha256":"2f67aa9ee55dd6eb2d7da4eaf1c8d50fd7e5e65f65492f7f1bb231d1c1f25027","catalog_spec_sha256":"9d43f8206879423cae808b9d8ffa10e1bf57334019f5672a86d6f0c23b8d4772","query_spec_sha256":"aa36d0260315b648079d01e78a36b1ec87f3f371e150477d7f8ab47920d7a2b2","normalization_spec_sha256":"9e78abdc2130b19cb414d520edeb6da4dfac0f481609efd244f22f6ba2b1e816","expected":{"row_count":1,"column_count":1,"normalized_schema_sha256":"56f599290f1abf6595d635262b973b8eb26db02e04f8b7aaebcc582df7cbe4e2","canonical_result_sha256":"48f7de9160702299adc2cb00311d9d23c378dcd30c6100e34a143346abecdfe1","release_candidate_cardinality":1,"dependency_candidate_cardinality":1035000,"release_candidate_set_sha256":"1a24cf7d957aeadb78a9d73d779662b2fc0c48a570abc674da817903a1452a79","dependency_candidate_set_sha256":"5d63478f9799ccd4635efded18e17bbb391dd753cdc9e9c429cb668d3c36c09b","existing_cardinality":1035000,"existing_set_sha256":"b788db727d20df5ddf023265de8b5b6744e78652cfd5bdc3d41e2078bd453b9f","overlap_cardinality":517500,"overlap_set_sha256":"15617980a7e5165c7b7fe249dbec33a1b6566654952a6cd62e39555babb95486","novel_cardinality":517500,"novel_set_sha256":"f1d7477bac3ac07f922b5521ac60c3dbabc46c6cb5b25f91eaf624b245ecf707","union_cardinality":1552500,"union_set_sha256":"5be68913c1cce5f89ce623203c46af90322f0c09348aae4ef213d3ff025435ab"},"generation":{"seed":20260803,"generator_version":"taskgate-final-v5-exposure-scale-semantic-manifest-v1","command":"final-v5-oracle scale-manifests --dataset-spec-sha256 2f67aa9ee55dd6eb2d7da4eaf1c8d50fd7e5e65f65492f7f1bb231d1c1f25027 --catalog-spec-sha256 9d43f8206879423cae808b9d8ffa10e1bf57334019f5672a86d6f0c23b8d4772 --query-spec-sha256 aa36d0260315b648079d01e78a36b1ec87f3f371e150477d7f8ab47920d7a2b2 --normalization-spec-sha256 9e78abdc2130b19cb414d520edeb6da4dfac0f481609efd244f22f6ba2b1e816"}}
